|------|-----------|---------------|---------------|---------|------|-------------------------------------------------------------------------------------------------------------------------|
|  296 |  1.804728 |   192.168.0.0 | 20.189.173.11 | TLSv1.2 |  177 | Application Data                                                                                                        |
|------|-----------|---------------|---------------|---------|------|-------------------------------------------------------------------------------------------------------------------------|
|  297 |  1.804866 |   192.168.0.0 | 20.189.173.11 | TCP     | 1494 | 59890  >  443 [ACK] Seq=124 Ack=1 Win=515 Len=1440                                                                      |
|------|-----------|---------------|---------------|---------|------|-------------------------------------------------------------------------------------------------------------------------|
|  298 |  1.804866 |   192.168.0.0 | 20.189.173.11 | TCP     |  661 | 59890  >  443 [PSH, ACK] Seq=1564 Ack=1 Win=515 Len=607 [TCP segment of a reassembled PDU]                              |
|------|-----------|---------------|---------------|---------|------|-------------------------------------------------------------------------------------------------------------------------|
|  306 |  1.823584 |   192.168.0.0 | 20.189.173.11 | TLSv1.2 |   89 | Application Data                                                                                                        |
|------|-----------|---------------|---------------|---------|------|-------------------------------------------------------------------------------------------------------------------------|
|  443 |  2.329867 | 20.189.173.11 |   192.168.0.0 | TCP     |   66 | 443  >  59890 [ACK] Seq=1 Ack=1 Win=16385 Len=0 SLE=124 SRE=1564                                                        |
|------|-----------|---------------|---------------|---------|------|-------------------------------------------------------------------------------------------------------------------------|
|  444 |  2.329867 | 20.189.173.11 |   192.168.0.0 | TCP     |   66 | [TCP Dup ACK 443#1] 443  >  59890 [ACK] Seq=1 Ack=1 Win=16385 Len=0 SLE=124 SRE=2171                                    |
|------|-----------|---------------|---------------|---------|------|-------------------------------------------------------------------------------------------------------------------------|
|  445 |  2.329867 | 20.189.173.11 |   192.168.0.0 | TCP     |   66 | [TCP Dup ACK 443#2] 443  >  59890 [ACK] Seq=1 Ack=1 Win=16385 Len=0 SLE=124 SRE=2206                                    |
|------|-----------|---------------|---------------|---------|------|-------------------------------------------------------------------------------------------------------------------------|
|  446 |  2.329914 |   192.168.0.0 | 20.189.173.11 | TLSv1.2 | 1494 | [TCP Fast Retransmission] , Application Data                                                                            |
|------|-----------|---------------|---------------|---------|------|-------------------------------------------------------------------------------------------------------------------------|
|  589 |  2.587176 | 20.189.173.11 |   192.168.0.0 | TCP     |   66 | 443  >  59890 [ACK] Seq=1 Ack=2206 Win=16385 Len=0 SLE=124 SRE=1441                                                     |
|------|-----------|---------------|---------------|---------|------|-------------------------------------------------------------------------------------------------------------------------|
| 1115 |  4.317124 |   192.168.0.0 | 20.189.173.11 | TLSv1.2 |  193 | Application Data                                                                                                        |
|------|-----------|---------------|---------------|---------|------|-------------------------------------------------------------------------------------------------------------------------|
| 1116 |  4.317218 |   192.168.0.0 | 20.189.173.11 | TCP     | 1494 | 59890  >  443 [ACK] Seq=2345 Ack=1 Win=515 Len=1440 [TCP segment of a reassembled PDU]                                  |
|------|-----------|---------------|---------------|---------|------|-------------------------------------------------------------------------------------------------------------------------|
| 1117 |  4.317218 |   192.168.0.0 | 20.189.173.11 | TCP     | 1494 | 59890  >  443 [ACK] Seq=3785 Ack=1 Win=515 Len=1440 [TCP segment of a reassembled PDU]                                  |
|------|-----------|---------------|---------------|---------|------|-------------------------------------------------------------------------------------------------------------------------|
| 1118 |  4.317218 |   192.168.0.0 | 20.189.173.11 | TCP     | 1494 | 59890  >  443 [ACK] Seq=5225 Ack=1 Win=515 Len=1440 [TCP segment of a reassembled PDU]                                  |
|------|-----------|---------------|---------------|---------|------|-------------------------------------------------------------------------------------------------------------------------|
| 1119 |  4.317218 |   192.168.0.0 | 20.189.173.11 | TCP     | 1494 | 59890  >  443 [ACK] Seq=6665 Ack=1 Win=515 Len=1440 [TCP segment of a reassembled PDU]                                  |
|------|-----------|---------------|---------------|---------|------|-------------------------------------------------------------------------------------------------------------------------|
| 1120 |  4.317218 |   192.168.0.0 | 20.189.173.11 | TCP     | 1494 | 59890  >  443 [ACK] Seq=8105 Ack=1 Win=515 Len=1440 [TCP segment of a reassembled PDU]                                  |
|------|-----------|---------------|---------------|---------|------|-------------------------------------------------------------------------------------------------------------------------|
| 1121 |  4.317218 |   192.168.0.0 | 20.189.173.11 | TCP     | 1494 | 59890  >  443 [ACK] Seq=9545 Ack=1 Win=515 Len=1440 [TCP segment of a reassembled PDU]                                  |
|------|-----------|---------------|---------------|---------|------|-------------------------------------------------------------------------------------------------------------------------|
| 1122 |  4.317218 |   192.168.0.0 | 20.189.173.11 | TCP     | 1494 | 59890  >  443 [ACK] Seq=10985 Ack=1 Win=515 Len=1440 [TCP segment of a reassembled PDU]                                 |
|------|-----------|---------------|---------------|---------|------|-------------------------------------------------------------------------------------------------------------------------|
| 1123 |  4.317218 |   192.168.0.0 | 20.189.173.11 | TCP     | 1494 | 59890  >  443 [ACK] Seq=12425 Ack=1 Win=515 Len=1440 [TCP segment of a reassembled PDU]                                 |
|------|-----------|---------------|---------------|---------|------|-------------------------------------------------------------------------------------------------------------------------|
| 1124 |  4.317218 |   192.168.0.0 | 20.189.173.11 | TCP     | 1494 | 59890  >  443 [ACK] Seq=13865 Ack=1 Win=515 Len=1440 [TCP segment of a reassembled PDU]                                 |
|------|-----------|---------------|---------------|---------|------|-------------------------------------------------------------------------------------------------------------------------|
| 1220 |  4.825152 | 20.189.173.11 |   192.168.0.0 | TCP     |   60 | 443  >  59890 [ACK] Seq=1 Ack=8105 Win=16379 Len=0                                                                      |
|------|-----------|---------------|---------------|---------|------|-------------------------------------------------------------------------------------------------------------------------|
| 1222 |  4.825225 |   192.168.0.0 | 20.189.173.11 | TCP     | 1494 | 59890  >  443 [ACK] Seq=15305 Ack=1 Win=515 Len=1440 [TCP segment of a reassembled PDU]                                 |
|------|-----------|---------------|---------------|---------|------|-------------------------------------------------------------------------------------------------------------------------|
| 1223 |  4.825225 |   192.168.0.0 | 20.189.173.11 | TCP     | 1494 | 59890  >  443 [ACK] Seq=16745 Ack=1 Win=515 Len=1440 [TCP segment of a reassembled PDU]                                 |
|------|-----------|---------------|---------------|---------|------|-------------------------------------------------------------------------------------------------------------------------|
| 1224 |  4.825225 |   192.168.0.0 | 20.189.173.11 | TLSv1.2 | 1494 | Application Data                                                                                                        |
|------|-----------|---------------|---------------|---------|------|-------------------------------------------------------------------------------------------------------------------------|
| 1225 |  4.825225 |   192.168.0.0 | 20.189.173.11 | TCP     | 1494 | 59890  >  443 [ACK] Seq=19625 Ack=1 Win=515 Len=1440 [TCP segment of a reassembled PDU]                                 |
|------|-----------|---------------|---------------|---------|------|-------------------------------------------------------------------------------------------------------------------------|
| 1226 |  4.825225 |   192.168.0.0 | 20.189.173.11 | TCP     | 1494 | 59890  >  443 [ACK] Seq=21065 Ack=1 Win=515 Len=1440 [TCP segment of a reassembled PDU]                                 |
|------|-----------|---------------|---------------|---------|------|-------------------------------------------------------------------------------------------------------------------------|
| 1288 |  5.107233 | 20.189.173.11 |   192.168.0.0 | TCP     |   66 | [TCP Dup ACK 1220#1] 443  >  59890 [ACK] Seq=1 Ack=8105 Win=16379 Len=0 SLE=10985 SRE=12425                             |
|------|-----------|---------------|---------------|---------|------|-------------------------------------------------------------------------------------------------------------------------|
| 1289 |  5.107280 |   192.168.0.0 | 20.189.173.11 | TCP     | 1494 | 59890  >  443 [ACK] Seq=22505 Ack=1 Win=515 Len=1440 [TCP segment of a reassembled PDU]                                 |
|------|-----------|---------------|---------------|---------|------|-------------------------------------------------------------------------------------------------------------------------|
| 1299 |  5.121573 |   192.168.0.0 | 20.189.173.11 | TCP     | 1494 | [TCP Retransmission] 59890  >  443 [ACK] Seq=8105 Ack=1 Win=515 Len=1440 [TCP segment of a reassembled PDU]             |
|------|-----------|---------------|---------------|---------|------|-------------------------------------------------------------------------------------------------------------------------|
| 1300 |  5.121587 |   192.168.0.0 | 20.189.173.11 | TCP     | 1494 | [TCP Retransmission] 59890  >  443 [ACK] Seq=9545 Ack=1 Win=515 Len=1440 [TCP segment of a reassembled PDU]             |
|------|-----------|---------------|---------------|---------|------|-------------------------------------------------------------------------------------------------------------------------|
| 1321 |  5.140630 | 20.189.173.11 |   192.168.0.0 | TCP     |   66 | [TCP Dup ACK 1220#2] 443  >  59890 [ACK] Seq=1 Ack=8105 Win=16379 Len=0 SLE=10985 SRE=13865                             |
|------|-----------|---------------|---------------|---------|------|-------------------------------------------------------------------------------------------------------------------------|
| 1322 |  5.140630 | 20.189.173.11 |   192.168.0.0 | TCP     |   66 | [TCP Dup ACK 1220#3] 443  >  59890 [ACK] Seq=1 Ack=8105 Win=16379 Len=0 SLE=10985 SRE=15305                             |
|------|-----------|---------------|---------------|---------|------|-------------------------------------------------------------------------------------------------------------------------|
| 1323 |  5.140666 |   192.168.0.0 | 20.189.173.11 | TCP     | 1494 | 59890  >  443 [ACK] Seq=23945 Ack=1 Win=515 Len=1440 [TCP segment of a reassembled PDU]                                 |
|------|-----------|---------------|---------------|---------|------|-------------------------------------------------------------------------------------------------------------------------|
| 1324 |  5.140713 |   192.168.0.0 | 20.189.173.11 | TCP     | 1494 | 59890  >  443 [ACK] Seq=25385 Ack=1 Win=515 Len=1440 [TCP segment of a reassembled PDU]                                 |
|------|-----------|---------------|---------------|---------|------|-------------------------------------------------------------------------------------------------------------------------|
| 1345 |  5.244968 | 20.189.173.11 |   192.168.0.0 | TCP     |   66 | [TCP Dup ACK 1220#4] 443  >  59890 [ACK] Seq=1 Ack=8105 Win=16379 Len=0 SLE=10985 SRE=16745                             |
|------|-----------|---------------|---------------|---------|------|-------------------------------------------------------------------------------------------------------------------------|
| 1346 |  5.244968 | 20.189.173.11 |   192.168.0.0 | TCP     |   66 | [TCP Dup ACK 1220#5] 443  >  59890 [ACK] Seq=1 Ack=8105 Win=16379 Len=0 SLE=10985 SRE=18185                             |
|------|-----------|---------------|---------------|---------|------|-------------------------------------------------------------------------------------------------------------------------|
| 1347 |  5.245018 |   192.168.0.0 | 20.189.173.11 | TCP     | 1494 | 59890  >  443 [ACK] Seq=26825 Ack=1 Win=515 Len=1440 [TCP segment of a reassembled PDU]                                 |
|------|-----------|---------------|---------------|---------|------|-------------------------------------------------------------------------------------------------------------------------|
| 1348 |  5.245062 |   192.168.0.0 | 20.189.173.11 | TCP     | 1494 | 59890  >  443 [ACK] Seq=28265 Ack=1 Win=515 Len=1440 [TCP segment of a reassembled PDU]                                 |
|------|-----------|---------------|---------------|---------|------|-------------------------------------------------------------------------------------------------------------------------|
| 1350 |  5.245122 | 20.189.173.11 |   192.168.0.0 | TCP     |   66 | [TCP Dup ACK 1220#6] 443  >  59890 [ACK] Seq=1 Ack=8105 Win=16379 Len=0 SLE=10985 SRE=19625                             |
|------|-----------|---------------|---------------|---------|------|-------------------------------------------------------------------------------------------------------------------------|
| 1351 |  5.245122 | 20.189.173.11 |   192.168.0.0 | TCP     |   66 | [TCP Dup ACK 1220#7] 443  >  59890 [ACK] Seq=1 Ack=8105 Win=16379 Len=0 SLE=10985 SRE=21065                             |
|------|-----------|---------------|---------------|---------|------|-------------------------------------------------------------------------------------------------------------------------|
| 1354 |  5.245145 |   192.168.0.0 | 20.189.173.11 | TCP     | 1494 | 59890  >  443 [ACK] Seq=29705 Ack=1 Win=515 Len=1440 [TCP segment of a reassembled PDU]                                 |
|------|-----------|---------------|---------------|---------|------|-------------------------------------------------------------------------------------------------------------------------|
| 1355 |  5.245180 |   192.168.0.0 | 20.189.173.11 | TCP     | 1494 | 59890  >  443 [ACK] Seq=31145 Ack=1 Win=515 Len=1440 [TCP segment of a reassembled PDU]                                 |
|------|-----------|---------------|---------------|---------|------|-------------------------------------------------------------------------------------------------------------------------|
| 1403 |  5.295840 | 20.189.173.11 |   192.168.0.0 | TCP     |   66 | [TCP Dup ACK 1220#8] 443  >  59890 [ACK] Seq=1 Ack=8105 Win=16379 Len=0 SLE=10985 SRE=22505                             |
|------|-----------|---------------|---------------|---------|------|-------------------------------------------------------------------------------------------------------------------------|
| 1404 |  5.295873 |   192.168.0.0 | 20.189.173.11 | TCP     | 1494 | 59890  >  443 [ACK] Seq=32585 Ack=1 Win=515 Len=1440 [TCP segment of a reassembled PDU]                                 |
|------|-----------|---------------|---------------|---------|------|-------------------------------------------------------------------------------------------------------------------------|
| 1447 |  5.348068 | 20.189.173.11 |   192.168.0.0 | TCP     |   66 | [TCP Dup ACK 1220#9] 443  >  59890 [ACK] Seq=1 Ack=8105 Win=16379 Len=0 SLE=10985 SRE=23945                             |
|------|-----------|---------------|---------------|---------|------|-------------------------------------------------------------------------------------------------------------------------|
| 1448 |  5.348101 |   192.168.0.0 | 20.189.173.11 | TLSv1.2 | 1494 | Application Data                                                                                                        |
|------|-----------|---------------|---------------|---------|------|-------------------------------------------------------------------------------------------------------------------------|
| 1478 |  5.475432 | 20.189.173.11 |   192.168.0.0 | TCP     |   66 | 443  >  59890 [ACK] Seq=1 Ack=9545 Win=16385 Len=0 SLE=10985 SRE=23945                                                  |
|------|-----------|---------------|---------------|---------|------|-------------------------------------------------------------------------------------------------------------------------|
| 1479 |  5.475432 | 20.189.173.11 |   192.168.0.0 | TCP     |   60 | 443  >  59890 [ACK] Seq=1 Ack=23945 Win=16385 Len=0                                                                     |
|------|-----------|---------------|---------------|---------|------|-------------------------------------------------------------------------------------------------------------------------|
| 1480 |  5.475456 |   192.168.0.0 | 20.189.173.11 | TCP     | 1494 | 59890  >  443 [ACK] Seq=35465 Ack=1 Win=515 Len=1440 [TCP segment of a reassembled PDU]                                 |
|------|-----------|---------------|---------------|---------|------|-------------------------------------------------------------------------------------------------------------------------|
| 1481 |  5.475493 |   192.168.0.0 | 20.189.173.11 | TCP     | 1494 | 59890  >  443 [ACK] Seq=36905 Ack=1 Win=515 Len=1440 [TCP segment of a reassembled PDU]                                 |
|------|-----------|---------------|---------------|---------|------|-------------------------------------------------------------------------------------------------------------------------|
| 1483 |  5.484832 | 20.189.173.11 |   192.168.0.0 | TCP     |   60 | 443  >  59890 [ACK] Seq=1 Ack=26825 Win=16385 Len=0                                                                     |
|------|-----------|---------------|---------------|---------|------|-------------------------------------------------------------------------------------------------------------------------|
| 1484 |  5.484832 | 20.189.173.11 |   192.168.0.0 | TCP     |   60 | 443  >  59890 [ACK] Seq=1 Ack=31145 Win=16385 Len=0                                                                     |
|------|-----------|---------------|---------------|---------|------|-------------------------------------------------------------------------------------------------------------------------|
| 1485 |  5.484872 |   192.168.0.0 | 20.189.173.11 | TCP     | 1494 | 59890  >  443 [ACK] Seq=38345 Ack=1 Win=515 Len=1440 [TCP segment of a reassembled PDU]                                 |
|------|-----------|---------------|---------------|---------|------|-------------------------------------------------------------------------------------------------------------------------|
| 1486 |  5.484872 |   192.168.0.0 | 20.189.173.11 | TCP     | 1494 | 59890  >  443 [ACK] Seq=39785 Ack=1 Win=515 Len=1440 [TCP segment of a reassembled PDU]                                 |
|------|-----------|---------------|---------------|---------|------|-------------------------------------------------------------------------------------------------------------------------|
| 1487 |  5.484872 |   192.168.0.0 | 20.189.173.11 | TCP     | 1494 | 59890  >  443 [ACK] Seq=41225 Ack=1 Win=515 Len=1440 [TCP segment of a reassembled PDU]                                 |
|------|-----------|---------------|---------------|---------|------|-------------------------------------------------------------------------------------------------------------------------|
| 1488 |  5.484872 |   192.168.0.0 | 20.189.173.11 | TCP     | 1494 | 59890  >  443 [ACK] Seq=42665 Ack=1 Win=515 Len=1440 [TCP segment of a reassembled PDU]                                 |
|------|-----------|---------------|---------------|---------|------|-------------------------------------------------------------------------------------------------------------------------|
| 1489 |  5.484872 |   192.168.0.0 | 20.189.173.11 | TCP     | 1494 | 59890  >  443 [ACK] Seq=44105 Ack=1 Win=515 Len=1440 [TCP segment of a reassembled PDU]                                 |
|------|-----------|---------------|---------------|---------|------|-------------------------------------------------------------------------------------------------------------------------|
| 1490 |  5.485219 | 20.189.173.11 |   192.168.0.0 | TCP     |   60 | 443  >  59890 [ACK] Seq=1 Ack=32585 Win=16379 Len=0                                                                     |
|------|-----------|---------------|---------------|---------|------|-------------------------------------------------------------------------------------------------------------------------|
| 1492 |  5.485263 |   192.168.0.0 | 20.189.173.11 | TCP     | 1494 | 59890  >  443 [ACK] Seq=45545 Ack=1 Win=515 Len=1440 [TCP segment of a reassembled PDU]                                 |
|------|-----------|---------------|---------------|---------|------|-------------------------------------------------------------------------------------------------------------------------|
| 1493 |  5.485263 |   192.168.0.0 | 20.189.173.11 | TCP     | 1494 | 59890  >  443 [ACK] Seq=46985 Ack=1 Win=515 Len=1440 [TCP segment of a reassembled PDU]                                 |
|------|-----------|---------------|---------------|---------|------|-------------------------------------------------------------------------------------------------------------------------|
| 1550 |  5.572176 | 20.189.173.11 |   192.168.0.0 | TCP     |   60 | 443  >  59890 [ACK] Seq=1 Ack=34025 Win=16385 Len=0                                                                     |
|------|-----------|---------------|---------------|---------|------|-------------------------------------------------------------------------------------------------------------------------|
| 1551 |  5.572206 |   192.168.0.0 | 20.189.173.11 | TCP     | 1494 | 59890  >  443 [ACK] Seq=48425 Ack=1 Win=515 Len=1440 [TCP segment of a reassembled PDU]                                 |
|------|-----------|---------------|---------------|---------|------|-------------------------------------------------------------------------------------------------------------------------|
| 1569 |  5.624571 | 20.189.173.11 |   192.168.0.0 | TCP     |   60 | 443  >  59890 [ACK] Seq=1 Ack=35465 Win=16379 Len=0                                                                     |
|------|-----------|---------------|---------------|---------|------|-------------------------------------------------------------------------------------------------------------------------|
| 1570 |  5.624600 |   192.168.0.0 | 20.189.173.11 | TCP     | 1494 | 59890  >  443 [ACK] Seq=49865 Ack=1 Win=515 Len=1440 [TCP segment of a reassembled PDU]                                 |
|------|-----------|---------------|---------------|---------|------|-------------------------------------------------------------------------------------------------------------------------|
| 1592 |  5.760869 | 20.189.173.11 |   192.168.0.0 | TCP     |   60 | 443  >  59890 [ACK] Seq=1 Ack=39785 Win=16385 Len=0                                                                     |
|------|-----------|---------------|---------------|---------|------|-------------------------------------------------------------------------------------------------------------------------|
| 1593 |  5.760908 |   192.168.0.0 | 20.189.173.11 | TLSv1.2 | 1494 | Application Data                                                                                                        |
|------|-----------|---------------|---------------|---------|------|-------------------------------------------------------------------------------------------------------------------------|
| 1594 |  5.760908 |   192.168.0.0 | 20.189.173.11 | TCP     | 1494 | 59890  >  443 [ACK] Seq=52745 Ack=1 Win=515 Len=1440 [TCP segment of a reassembled PDU]                                 |
|------|-----------|---------------|---------------|---------|------|-------------------------------------------------------------------------------------------------------------------------|
| 1595 |  5.760908 |   192.168.0.0 | 20.189.173.11 | TCP     | 1494 | 59890  >  443 [ACK] Seq=54185 Ack=1 Win=515 Len=1440 [TCP segment of a reassembled PDU]                                 |
|------|-----------|---------------|---------------|---------|------|-------------------------------------------------------------------------------------------------------------------------|
| 1596 |  5.761327 | 20.189.173.11 |   192.168.0.0 | TCP     |   60 | 443  >  59890 [ACK] Seq=1 Ack=41225 Win=16379 Len=0                                                                     |
|------|-----------|---------------|---------------|---------|------|-------------------------------------------------------------------------------------------------------------------------|
| 1597 |  5.761344 |   192.168.0.0 | 20.189.173.11 | TCP     | 1494 | 59890  >  443 [ACK] Seq=55625 Ack=1 Win=515 Len=1440 [TCP segment of a reassembled PDU]                                 |
|------|-----------|---------------|---------------|---------|------|-------------------------------------------------------------------------------------------------------------------------|
| 1598 |  5.761758 | 20.189.173.11 |   192.168.0.0 | TCP     |   60 | 443  >  59890 [ACK] Seq=1 Ack=44105 Win=16385 Len=0                                                                     |
|------|-----------|---------------|---------------|---------|------|-------------------------------------------------------------------------------------------------------------------------|
| 1599 |  5.761769 |   192.168.0.0 | 20.189.173.11 | TCP     | 1494 | 59890  >  443 [ACK] Seq=57065 Ack=1 Win=515 Len=1440 [TCP segment of a reassembled PDU]                                 |
|------|-----------|---------------|---------------|---------|------|-------------------------------------------------------------------------------------------------------------------------|
| 1600 |  5.761769 |   192.168.0.0 | 20.189.173.11 | TCP     | 1494 | 59890  >  443 [ACK] Seq=58505 Ack=1 Win=515 Len=1440 [TCP segment of a reassembled PDU]                                 |
|------|-----------|---------------|---------------|---------|------|-------------------------------------------------------------------------------------------------------------------------|
| 1601 |  5.761981 | 20.189.173.11 |   192.168.0.0 | TCP     |   60 | 443  >  59890 [ACK] Seq=1 Ack=46985 Win=16385 Len=0                                                                     |
|------|-----------|---------------|---------------|---------|------|-------------------------------------------------------------------------------------------------------------------------|
| 1602 |  5.761998 |   192.168.0.0 | 20.189.173.11 | TCP     | 1494 | 59890  >  443 [ACK] Seq=59945 Ack=1 Win=515 Len=1440 [TCP segment of a reassembled PDU]                                 |
|------|-----------|---------------|---------------|---------|------|-------------------------------------------------------------------------------------------------------------------------|
| 1603 |  5.761998 |   192.168.0.0 | 20.189.173.11 | TCP     | 1494 | 59890  >  443 [ACK] Seq=61385 Ack=1 Win=515 Len=1440 [TCP segment of a reassembled PDU]                                 |
|------|-----------|---------------|---------------|---------|------|-------------------------------------------------------------------------------------------------------------------------|
| 1644 |  5.906773 | 20.189.173.11 |   192.168.0.0 | TCP     |   60 | 443  >  59890 [ACK] Seq=1 Ack=48425 Win=16379 Len=0                                                                     |
|------|-----------|---------------|---------------|---------|------|-------------------------------------------------------------------------------------------------------------------------|
| 1646 |  5.906853 |   192.168.0.0 | 20.189.173.11 | TCP     | 1494 | 59890  >  443 [ACK] Seq=62825 Ack=1 Win=515 Len=1440 [TCP segment of a reassembled PDU]                                 |
|------|-----------|---------------|---------------|---------|------|-------------------------------------------------------------------------------------------------------------------------|
| 1647 |  5.906853 |   192.168.0.0 | 20.189.173.11 | TCP     | 1494 | 59890  >  443 [ACK] Seq=64265 Ack=1 Win=515 Len=1440 [TCP segment of a reassembled PDU]                                 |
|------|-----------|---------------|---------------|---------|------|-------------------------------------------------------------------------------------------------------------------------|
| 1702 |  6.196189 | 20.189.173.11 |   192.168.0.0 | TCP     |   60 | 443  >  59890 [ACK] Seq=1 Ack=51305 Win=16385 Len=0                                                                     |
|------|-----------|---------------|---------------|---------|------|-------------------------------------------------------------------------------------------------------------------------|
| 1703 |  6.196278 |   192.168.0.0 | 20.189.173.11 | TCP     | 1494 | 59890  >  443 [ACK] Seq=65705 Ack=1 Win=515 Len=1440 [TCP segment of a reassembled PDU]                                 |
|------|-----------|---------------|---------------|---------|------|-------------------------------------------------------------------------------------------------------------------------|
| 1704 |  6.196278 |   192.168.0.0 | 20.189.173.11 | TLSv1.2 | 1494 | Application Data                                                                                                        |
|------|-----------|---------------|---------------|---------|------|-------------------------------------------------------------------------------------------------------------------------|
| 1706 |  6.212346 | 20.189.173.11 |   192.168.0.0 | TCP     |   60 | 443  >  59890 [ACK] Seq=1 Ack=58505 Win=16385 Len=0                                                                     |
|------|-----------|---------------|---------------|---------|------|-------------------------------------------------------------------------------------------------------------------------|
| 1708 |  6.212436 |   192.168.0.0 | 20.189.173.11 | TCP     | 1494 | 59890  >  443 [ACK] Seq=68585 Ack=1 Win=515 Len=1440 [TCP segment of a reassembled PDU]                                 |
|------|-----------|---------------|---------------|---------|------|-------------------------------------------------------------------------------------------------------------------------|
| 1709 |  6.212436 |   192.168.0.0 | 20.189.173.11 | TCP     | 1494 | 59890  >  443 [ACK] Seq=70025 Ack=1 Win=515 Len=1440 [TCP segment of a reassembled PDU]                                 |
|------|-----------|---------------|---------------|---------|------|-------------------------------------------------------------------------------------------------------------------------|
| 1710 |  6.212436 |   192.168.0.0 | 20.189.173.11 | TCP     | 1494 | 59890  >  443 [ACK] Seq=71465 Ack=1 Win=515 Len=1440 [TCP segment of a reassembled PDU]                                 |
|------|-----------|---------------|---------------|---------|------|-------------------------------------------------------------------------------------------------------------------------|
| 1711 |  6.212436 |   192.168.0.0 | 20.189.173.11 | TCP     | 1494 | 59890  >  443 [ACK] Seq=72905 Ack=1 Win=515 Len=1440 [TCP segment of a reassembled PDU]                                 |
|------|-----------|---------------|---------------|---------|------|-------------------------------------------------------------------------------------------------------------------------|
| 1712 |  6.212436 |   192.168.0.0 | 20.189.173.11 | TCP     | 1494 | 59890  >  443 [ACK] Seq=74345 Ack=1 Win=515 Len=1440 [TCP segment of a reassembled PDU]                                 |
|------|-----------|---------------|---------------|---------|------|-------------------------------------------------------------------------------------------------------------------------|
| 1784 |  6.419060 | 20.189.173.11 |   192.168.0.0 | TCP     |   66 | [TCP Dup ACK 1706#1] 443  >  59890 [ACK] Seq=1 Ack=58505 Win=16385 Len=0 SLE=61385 SRE=62825                            |
|------|-----------|---------------|---------------|---------|------|-------------------------------------------------------------------------------------------------------------------------|
| 1787 |  6.419112 |   192.168.0.0 | 20.189.173.11 | TCP     | 1494 | 59890  >  443 [ACK] Seq=75785 Ack=1 Win=515 Len=1440 [TCP segment of a reassembled PDU]                                 |
|------|-----------|---------------|---------------|---------|------|-------------------------------------------------------------------------------------------------------------------------|
| 1790 |  6.428928 |   192.168.0.0 | 20.189.173.11 | TCP     | 1494 | [TCP Retransmission] 59890  >  443 [ACK] Seq=58505 Ack=1 Win=515 Len=1440 [TCP segment of a reassembled PDU]            |
|------|-----------|---------------|---------------|---------|------|-------------------------------------------------------------------------------------------------------------------------|
| 1860 |  6.590872 | 20.189.173.11 |   192.168.0.0 | TCP     |   66 | [TCP Dup ACK 1706#2] 443  >  59890 [ACK] Seq=1 Ack=58505 Win=16385 Len=0 SLE=61385 SRE=64265                            |
|------|-----------|---------------|---------------|---------|------|-------------------------------------------------------------------------------------------------------------------------|
| 1861 |  6.590872 | 20.189.173.11 |   192.168.0.0 | TCP     |   66 | [TCP Dup ACK 1706#3] 443  >  59890 [ACK] Seq=1 Ack=58505 Win=16385 Len=0 SLE=61385 SRE=65705                            |
|------|-----------|---------------|---------------|---------|------|-------------------------------------------------------------------------------------------------------------------------|
| 1862 |  6.590905 |   192.168.0.0 | 20.189.173.11 | TCP     | 1494 | [TCP Retransmission] 59890  >  443 [ACK] Seq=59945 Ack=1 Win=515 Len=1440 [TCP segment of a reassembled PDU]            |
|------|-----------|---------------|---------------|---------|------|-------------------------------------------------------------------------------------------------------------------------|
| 2096 |  7.243148 |   192.168.0.0 | 20.189.173.11 | TCP     |   66 | 59910  >  443 [SYN] Seq=0 Win=64240 Len=0 MSS=1460 WS=256 SACK_PERM                                                     |
|------|-----------|---------------|---------------|---------|------|-------------------------------------------------------------------------------------------------------------------------|
| 2152 |  7.500158 |   192.168.0.0 | 20.189.173.11 | TCP     |   66 | 59911  >  443 [SYN] Seq=0 Win=64240 Len=0 MSS=1460 WS=256 SACK_PERM                                                     |
|------|-----------|---------------|---------------|---------|------|-------------------------------------------------------------------------------------------------------------------------|
| 2308 |  7.847284 | 20.189.173.11 |   192.168.0.0 | TCP     |   74 | [TCP Dup ACK 1706#4] 443  >  59890 [ACK] Seq=1 Ack=58505 Win=16385 Len=0 SLE=68585 SRE=70025 SLE=61385 SRE=65705        |
|------|-----------|---------------|---------------|---------|------|-------------------------------------------------------------------------------------------------------------------------|
| 2310 |  7.847333 |   192.168.0.0 | 20.189.173.11 | TCP     | 1494 | [TCP Retransmission] 59890  >  443 [ACK] Seq=65705 Ack=1 Win=515 Len=1440 [TCP segment of a reassembled PDU]            |
|------|-----------|---------------|---------------|---------|------|-------------------------------------------------------------------------------------------------------------------------|
| 2311 |  7.847333 |   192.168.0.0 | 20.189.173.11 | TCP     | 1494 | [TCP Retransmission] 59890  >  443 [PSH, ACK] Seq=67145 Ack=1 Win=515 Len=1440 [TCP segment of a reassembled PDU]       |
|------|-----------|---------------|---------------|---------|------|-------------------------------------------------------------------------------------------------------------------------|
| 2312 |  7.847379 |   192.168.0.0 | 20.189.173.11 | TCP     | 1494 | 59890  >  443 [ACK] Seq=77225 Ack=1 Win=515 Len=1440 [TCP segment of a reassembled PDU]                                 |
|------|-----------|---------------|---------------|---------|------|-------------------------------------------------------------------------------------------------------------------------|
| 2330 |  7.882719 | 20.189.173.11 |   192.168.0.0 | TCP     |   74 | [TCP Dup ACK 1706#5] 443  >  59890 [ACK] Seq=1 Ack=58505 Win=16385 Len=0 SLE=68585 SRE=71465 SLE=61385 SRE=65705        |
|------|-----------|---------------|---------------|---------|------|-------------------------------------------------------------------------------------------------------------------------|
| 2331 |  7.882752 |   192.168.0.0 | 20.189.173.11 | TCP     | 1494 | 59890  >  443 [ACK] Seq=78665 Ack=1 Win=515 Len=1440 [TCP segment of a reassembled PDU]                                 |
|------|-----------|---------------|---------------|---------|------|-------------------------------------------------------------------------------------------------------------------------|
| 2332 |  7.882798 | 20.189.173.11 |   192.168.0.0 | TCP     |   74 | [TCP Dup ACK 1706#6] 443  >  59890 [ACK] Seq=1 Ack=58505 Win=16385 Len=0 SLE=68585 SRE=72905 SLE=61385 SRE=65705        |
|------|-----------|---------------|---------------|---------|------|-------------------------------------------------------------------------------------------------------------------------|
| 2333 |  7.882808 |   192.168.0.0 | 20.189.173.11 | TCP     | 1494 | 59890  >  443 [ACK] Seq=80105 Ack=1 Win=515 Len=1440 [TCP segment of a reassembled PDU]                                 |
|------|-----------|---------------|---------------|---------|------|-------------------------------------------------------------------------------------------------------------------------|
